,Rid,RDate,Sentence,Sentiment,Rating,Loyalty
482,96,20/11/2013,i got the modelx back in march 2013 a few months after it came out and have had it now for about eight months.,42,0.8,1
483,96,20/11/2013,it is a really nice computer.,51,0.8,0
484,96,20/11/2013,it is the most thin and lightweight computer i have ever had.,33,0.8,0
485,96,20/11/2013,windows 8 took a while to figure out but eventually you get used to it.,49,0.8,0
486,96,20/11/2013,"i also had an issue with it always showing fingerprints on the outside and on the mouse pad every time someone touched the laptop when it was new, but i don not really notice anymore the longer i have had it.",10,0.8,0
487,96,20/11/2013,it is packed full of features.,50,0.8,0
488,96,20/11/2013,"everything i wanted in a laptop, this laptop has.",30,0.8,0
489,96,20/11/2013,"it has a nice webcam, a big enough screen, nice graphics, tons of apps, large hard drive, nice speakers, spaced out keyboard, numeric pad, several usb ports & external drives, media card reader, long battery life, fast processor, a cd/dvd drive, doesn not have a loud fan, doesn not heat up that much, smaller/durable computer charger, is very portable, easy to travel with, and has a nice exterior design.",12,0.8,0
490,96,20/11/2013,i got it for a reasonable price with a discount.,58,0.8,0
491,96,20/11/2013,"after having the modelx, it is the exact same thing as more expensive and popular laptop brandxs except way cheaper and very affordable.",41,0.8,0
492,96,20/11/2013,i definitely don not regret purchasing this laptop and would buy it again any day.,29,0.8,0
493,97,20/11/2013,"given this laptop for my birthday and exceedingly pleased, windows 8 is fantastic as i gives you the option to go to normal view and the new layout.",82,0.8,0
494,97,20/11/2013,"the laptop itself is excellent, having used my old brandx desktop for the last 10 years, couldn not have hoped for a better laptop
nice for me to use as a student as i can do everything that i want to do and for my mum who uses it as well, so good to use for all people as you can do a variety of things.",52,0.8,1
495,97,20/11/2013,"only thing i would say is that the charge does not last for 7 hours on the go, but other than that fantastic, nice to be able to do tings quickly rather than wait an age to get anything done.",52,0.8,0
496,98,20/11/2013,many weeks of watching deals pass me by of touchscreen laptops.,44,0.8,0
497,98,20/11/2013,i didn not want to spend lot (didn not need financing).,24,0.8,0
498,98,20/11/2013,i chose the modelx.,48,0.8,0
499,98,20/11/2013,so far so good!,55,0.8,0
500,98,20/11/2013,"windows 8 was really not that hard, but different.",29,0.8,0
501,98,20/11/2013,"i ordered on monday 3/11 and arrived 3/14, now that is fast delivery.",46,0.8,0
502,98,20/11/2013,i have watched several movies and the screen was excellent.,64,0.8,0
503,98,20/11/2013,"i am attaching some pictures of what is not so great and maybe not a big deal, but i have only used it for 3 days and fingerprints on the touch pad and the outside cover show!",61,0.8,0
504,98,20/11/2013,"other than the fingerprints (yes i always wash my hands before i use the laptop), the laptop speed is great.",57,0.8,0
505,98,20/11/2013,i will upgrade the ram at a later date.,48,0.8,0
506,98,20/11/2013,"the only question i am waiting on brandx to answer for me:
should i get a screen protector for the touch screen?",42,0.8,0
507,98,20/11/2013,is the outside cover replaceable (to something that doesn not show a lot of fingerprints)?,39,0.8,0
508,99,21/11/2013,i find the computer friendly and easy to get around once i got used to windows 8. love the number key pad and how everything is easy to find and exccess.,53,0.8,0
509,99,21/11/2013,love my computer.,52,0.8,0
510,99,21/11/2013,i was able to load software that i already had.,24,0.8,0
511,99,21/11/2013,it is easy to download from the store.,51,0.8,0
512,100,21/11/2013,"i have 3 brandxs in the house, this is the 4rth.",48,0.8,0
513,100,21/11/2013,"all are still working
great.",52,0.8,0
514,100,21/11/2013,"this modelx, the touchscreen stopped functioning.",33,0.8,0
515,100,21/11/2013,"i called brandx up, and less than 2 minutes, brandx had to update drivers and i was up and running again.",34,0.8,1
516,100,21/11/2013,"at that time, i had so many question with this new system, amy at brandx was more than happy to help me resolve all
of my questions.",67,0.8,0
517,100,21/11/2013,i was on the phone 1 hour with her.,39,0.8,0
518,100,21/11/2013,"brandx stands behind their products, and they have always helped me resolve any issue.",49,0.8,0
519,100,21/11/2013,i am so glad i have this new modelx to work with!,53,0.8,1
520,101,23/1/2014,i bought my brandx modelx n5010 laptop in may of 2011.,43,1.0,0
521,101,23/1/2014,i haven not had any problems with it.,28,1.0,0
522,101,23/1/2014,still using it today.,47,1.0,0
523,101,23/1/2014,"when i was shopping for a laptop i was going to get the cheapes one i could find, but then said to myself why get one that would only last for a little bit then i would have to go and buy anotherone anyway.",23,1.0,0
524,101,23/1/2014,"i have had other brandx stuff before, so i know that the price i paid is well worth it.",50,1.0,1
525,101,23/1/2014,soon i am going to get me another laptop hear soon and its going to be a brandx to.,36,1.0,0
526,101,23/1/2014,i have told a few of my friends about it and thay to are going to get a brandx also.,48,1.0,0
527,102,19/11/2013,"i am very pleased with this product, it works great with surfing the web, light gaming and watching videos.",88,1.0,0
528,102,19/11/2013,i am very pleased with my brandx.,60,1.0,0
529,102,19/11/2013,"i did however go for the upgraded ram to a 6gb and a non-touch, which may make a difference in performance.",43,1.0,0
530,102,19/11/2013,"stays cool after long usage, my only complain is that if you type with your wrist resting on the front edge of the laptop, it really digs into your skin.",65,1.0,0
531,103,19/11/2013,"it is very good,i use it every day and it is very usefull to me.",64,1.0,0
532,104,19/11/2013,"i am a highschool student, and i was looking to purchase a laptop that was quicker to make school work easier.",42,1.0,0
533,104,19/11/2013,"this laptop is great not only for school work, but every other type of daily use.",35,1.0,0
534,104,19/11/2013,it loads videos on netflix in a matter of seconds.,53,1.0,0
535,104,19/11/2013,it is fast for web surfing (even with the celeron core).,49,1.0,0
536,104,19/11/2013,"one great feature is the start up time, which takes under a minute.",62,1.0,0
537,104,19/11/2013,the battery life is decent.,36,1.0,0
538,104,19/11/2013,i get over 4 hours on light usage.,39,1.0,0
539,104,19/11/2013,it is also very quiet (you cant hear the fan) and it doesn not get hot.,42,1.0,0
540,104,19/11/2013,two complaints that i saw when researching were that the trackpad is unresponsive and the keyboard is hard to type on and not well built.,25,1.0,0
541,104,19/11/2013,i would disagree with both of those.,55,1.0,0
542,104,19/11/2013,"the track pad on mine is very responsive, and the keyboard is well built and easy to type on.",57,1.0,0
543,104,19/11/2013,"another complaint was windows 8. personally, i think it is a huge improvement from windows 7. it is much easier to personalize and to use.",54,1.0,0
544,104,19/11/2013,overall this laptop is a great bargain.,63,1.0,0
545,104,19/11/2013,"it is well built (the fact that it is plastic isn not an issue - it is very sturdy and the texture is nice for repelling fingerprints), and works perfectly.",63,1.0,0
546,104,19/11/2013,i have had no issues with it at all.,29,1.0,0
547,105,19/11/2013,"i love this laptop.this is my second laptop, and this is awesome the intel core i3 processor provides very fast and powerful performance for my modelx.my laptop is ideal for students like me and i would recommend this laptop to anyone
and this laptop is selling out very fastly in my country,sri lanka.it is the most-selling laptop in my country.the quality of the display is very bright and vivid.the touchpad is very responsive and the sound quality is superb!overall the best value for the money.you will never go wrong with this laptop.modelx is a spectacular laptop.thank you brandx for making a very good laptop like this,thank you brandx.",96,1.0,0
548,106,19/11/2013,i received my computer back in april and i am really surprised by its performance.,42,1.0,0
549,106,19/11/2013,i have the i3 3rd gen. with 6gb of ram.,39,1.0,0
550,106,19/11/2013,its very responsive.,44,1.0,0
551,106,19/11/2013,"i read other reviews, i have no clue what others are talking about, my computer boots up exceptionally quick.",44,1.0,0
552,106,19/11/2013,"i do a lot of media editing, student work and i put the processor and graphics to the test.",43,1.0,0
553,106,19/11/2013,they are standing strong.,51,1.0,0
554,106,19/11/2013,im running programs very heavy on the processor such as ableton live and adobe photoshop and i am not disappointed.,13,1.0,0
555,106,19/11/2013,"if someone will tell you otherwise about this processor is abilities, theyre not the ""expert"" they are claiming to be.",58,1.0,0
556,107,19/11/2013,i did a lot of research before buying the modelx from brandx.,54,1.0,0
557,107,19/11/2013,"in terms of features for $, i couldn not find a better deal than brandx.",35,1.0,0
558,107,19/11/2013,"as well, buying from a reputable source sealed the deal.",65,1.0,0
559,108,19/11/2013,it is a great machine.,58,1.0,0
560,108,19/11/2013,work well and give me 100% satisfaction.,52,1.0,0
561,108,19/11/2013,thanks brandx !,69,1.0,0
562,109,19/11/2013,this is a great item and has wonderful features.,69,1.0,0
563,109,19/11/2013,i would recommend this product to anyone,57,1.0,0
564,110,11/12/2013,"affordable computer, excellent performance..great for college kids.",73,0.8,0
565,111,11/10/2013,"i bought this laptop as a gift for someone and they loved it, it works really good.",62,1.0,0
566,112,12/12/2013,"hey it is not perfect, but you cannot beat the overall performance for the price.",61,0.8,0
567,113,19/11/2013,"great assets, lightweight, excellent battery time and screen resolution and brightness.",42,0.8,0
568,113,19/11/2013,great laptop overall.,58,0.8,0
569,114,19/11/2013,"it has a clear, sharp wide screen and boots up quickly.",45,0.8,0
570,114,19/11/2013,i am quite happy with this machine.,62,0.8,0
571,115,19/11/2013,this is one great laptop and a great deal.,55,0.8,0
572,115,19/11/2013,"i see allot of reviews saying haw bad windows 8 but it just takes a little getting use to, once you know how to use the feature it has it works great.",45,0.8,0
573,115,19/11/2013,though i did not get the touch screen and should have for windows 8.,32,0.8,0
574,116,11/12/2013,i recommend any brandx product to anybody !!!!!!!!,55,0.8,0
575,116,11/12/2013,we own several brandx laptops and never had any grief on buying any of them.,41,0.8,1
576,117,11/10/2013,enjoying my new laptop.,60,0.8,0
577,117,11/10/2013,surpassed my expectations.,61,0.8,0
578,117,11/10/2013,highly recommend it!,65,0.8,0
579,118,12/12/2013,have had no problems....love the machine!,38,0.8,0
580,118,12/12/2013,enjoy the speed...the touch screen...and overall display.,63,0.8,0
581,119,19/11/2013,this pc has great features and i ues it for everything,60,0.8,0
582,120,19/11/2013,"first off, i want to say i have the ipad mini, ipad 2, the nook hd, and the kindle fire hd.",43,0.8,0
583,120,19/11/2013,all very impressive tablets.,52,0.8,0
584,120,19/11/2013,"however, i have always wanted a tablet with enough power to run windows 8.",28,0.8,0
585,120,19/11/2013,"after weeks of research, i had my eye on the sony tap 11, microsoft surface 2, microsoft surface pro 2, acer w4, and the lenovo miix2.",32,0.8,0
586,120,19/11/2013,i have experimented with other tablets including the surfaces and found a strong interest in their performance but i couldn not agree with the prices and the strip down version of windows 8.,36,0.8,0
587,120,19/11/2013,then i found this little gem.,55,0.8,0
588,120,19/11/2013,"a tablet with powerful hardware, a full windows 8.1 os, and a price nearly impossible to beat.",43,0.8,0
589,120,19/11/2013,the reviews seemed to rate this tablet 4.5/5 i was convinced.,35,0.8,0
590,120,19/11/2013,"after receiving the product, i fell in love with the performance as well as the speed, capabilities, and execution of the tablet.",53,0.8,0
591,120,19/11/2013,i stream all my files from my laptop which allows me to relax without carrying my laptop around.,34,0.8,0
592,120,19/11/2013,"as for the windows 8, in the beginning, i was never drawn to the os because windows 7 was all i accepted.",31,0.8,0
593,120,19/11/2013,"yet, i truly feel that the windows 8 should remain existent to only touch base computers and tablets because the shortcuts you hate on windows 8 will be the things you appreciate using this tablet.",18,0.8,0
594,120,19/11/2013,i seriously recommend this tablet.,47,0.8,0
595,120,19/11/2013,"pros:full windows 8.1, full microsoft office 2013 student home, speed and touch sensitivity, great brightness at its resolution cons:driver updates for cpu, sound is decent, may need stylus for desktop.",20,0.8,0
596,121,19/11/2013,i am a technical professional  haveteran' (which just means old) of the semiconductor industry.,59,0.8,0
597,121,19/11/2013,"i have long been searching for a single, very mobile device that allows to travel light, yet effectively be capable when needed.",38,0.8,0
598,121,19/11/2013,(my company is a ms based enterprise).,50,0.8,0
599,121,19/11/2013,i was pleasantly surprised with this device.,81,0.8,0
600,121,19/11/2013,i will try and highlight my experience (i now have 2 :) one for the wife.,58,0.8,0
601,121,19/11/2013,highlights- screen - excellent.,66,0.8,0
602,121,19/11/2013,"will not be redundant here with detail, performance - excellent, surprisingly so.",70,0.8,0
603,121,19/11/2013,"i run full office365, some sharepoint apps and an old version of paperport.",54,0.8,0
604,121,19/11/2013,no lag at all.,37,0.8,0
605,121,19/11/2013,extremely pleased.connectivity - excellent.,70,0.8,0
606,121,19/11/2013,the dual band wifi has so far exceeded any other mobile device i have owned.,20,0.8,0
607,121,19/11/2013,one exception and this one of only 2 minor misses.,22,0.8,0
608,121,19/11/2013,"miracast for display is problematic(but works..with effort) knew this going in, but a mini-hdmi would make this an amazing tool for a traveling professional.",47,0.8,0
609,121,19/11/2013,input devices : this one disappointed me a bit.,30,0.8,0
610,121,19/11/2013,if you are looking for a similar stylus experience to the 'note' then this isn not for you if it is critical.,54,0.8,0
611,121,19/11/2013,very 'marginal' for handwritten notes in 'onenote'.,52,0.8,0
612,121,19/11/2013,"strokes are sensitive, but 'jittery'.",40,0.8,0
613,121,19/11/2013,i use it for the handwriting input panel in win8.1 and works fine for this.,66,0.8,0
614,121,19/11/2013,no issues hooking up bluetooth mouse and keyboard.,29,0.8,0
615,121,19/11/2013,personal use : excellent.,70,0.8,0
616,121,19/11/2013,note: i would recommend only 64gb model!,58,0.8,0
617,121,19/11/2013,"i made a mistake on my first one and ended up with 32gb (wife has this now) :) in my opinion, 32gb should not be sold.",32,0.8,0
618,121,19/11/2013,"you max out the memory in a heart beat, especially if you are using business apps.",60,0.8,0
619,121,19/11/2013,works excellent as media/reader/movies etc.,78,0.8,0
620,121,19/11/2013,5gb 1080p mkv files with pass through dts audio play flawless in vlc.i give value 5 for 5 despite the 2 minor misses as i consider those my 'quest for the ultimate portable' and it is hard to knock considering the price-point and value.,31,0.8,0
621,121,19/11/2013,if this device had a mini-hdmi so i could use to present ppt and a smoother stylus for hand-writing notes on par with wacomm...this would be the device i have always searched for.,27,0.8,0
622,121,19/11/2013,"but hey, for the money amazing value/performance and quality.",73,0.8,0
623,121,19/11/2013,nice job brandx.,59,0.8,0
624,121,19/11/2013,"pros:screen, performance, mobility, battery, quality of build cons:stylus - 'jittery' but sensitive, no mini-hdmi.",14,0.8,0
