Product,Source,Source Date,Rating,Customer Verbatim,Quality Impact,Loyalty,Purchase Decision,Root Want,Sentiment,Features,Opinion Sentence,Loyalty Param
Inspiron 15,ecommerce Website,25/1/2014,5/5,"after my last dell inspiron hit the skids after just a year (including a new fan being put in a few months before by dell) i couldnt decide whether to opt for a dell again. my previous one lastest 3 years, so decided to take the plunge again and it was well worth it. I got the none touchscreen with i3 processor - and i havent got a single regret. The laptop is much faster than my previous one, there is barely any sound or heat. the graphics are clear, and it doesnt seem to bogged down with dell software like my last one did. personally im thrilled that the mains socket is on the left rather than the back, as wherever i am, the mains sockets are always to my left. the number pad isnt really useful to me, and would much rather have a fuller keyboard but it doesnt bother me and im sure some will find it useful. windows 8 is a bit scary at first, but its actually a great operating system and is well worth having once you get used to it - makes the whole thing more fluid and personal once you pin and move all your apps. The laptop is light weight but sturdy (although the cd drive feels a bit too flimsy underneath) but the battery life is decent In fact everything about this laptop is great for the price range. its 5 stars from me.",To be derived,To be derived,To be derived,To be derived,To be derived,,,
Inspiron 15,ecommerce Website,22/1/2014,4.5/5,"Like a desktop away from your desktop. I use the Inspiron for all my computing needs, the non-touch is definitely worth the money, and that extra hundred for touch is preference. It has common durability. Get Windows 8 pro for the extra security (Bitlocker), extra speed, and accessibility. It feels like a small desktop, and ironically has more storage than my Windows 7 Gateway. Dell is definitely the way to go for laptops.",To be derived,To be derived,To be derived,To be derived,To be derived,,,
Inspiron 15,ecommerce Website,22/1/2014,4/5,"First time to use win8, disappoint to me, 64bits, slow for i3 cpu, and don't like the design to take out battary. lucky me, only like the appearance and material.",To be derived,To be derived,To be derived,To be derived,To be derived,,,
Inspiron 15,ecommerce Website,17/1/2014,4/5,"Unfortunately, I did not start using my computer in time to realize that I did not like it, or I definitely would have returned it. The operating system is great, and basically everything about the computer is good, except for the loud touch pad. This may make a great computer for a high school student, or a college student, but not for someone who does not want a loud clicking sound from the touch pad disrupting meetings. Other than that, it's not a bad buy. It's my third Dell purchase, and probably my last.",To be derived,To be derived,To be derived,To be derived,To be derived,,,
Inspiron 15,ecommerce Website,14/1/2014,4/5,It not Widi ready so if you are planning to use it with you HDTV or Smart Tv don't bother. It dose not have Intel Widi.,To be derived,To be derived,To be derived,To be derived,To be derived,,,
Inspiron 15,ecommerce Website,22/12/2013,4/5,"This PC is responsive, fast, and easy-to-use. I was skeptical of the Windows 8 operating system, but it is very nice.",To be derived,To be derived,To be derived,To be derived,To be derived,,,
Inspiron 15,ecommerce Website,22/12/2014,4/5,my fault that I didn't understand no dvd/dvr writer but other than that very happy with what I got for what I paid,To be derived,To be derived,To be derived,To be derived,To be derived,,,
Inspiron 15,ecommerce Website,17/11/2013,4/5,"Unbelievably! Who ever heard of a new laptop whereas a CD or DVD drive is optional? I thought I reviewed this product thoroughly before purchasing, but this one got past me. I came back online, today, to see if the part was missing, and that's when I realized the darn thing is optional. Then, when I clicked to choose one, I was taken to a goofy page that explained how to choose one, only. I am clueless which DVD drive is compatible for this laptop. I searched all DVD drives (don't want a CD type), but got tired of clicking to see that this model was not listed. You know that annoying floating-popup asking if you want to chat? I clicked it just to read that chat is not available, try later. Lordy!",To be derived,To be derived,To be derived,To be derived,To be derived,,,
Inspiron 15,ecommerce Website,17/11/2013,4/5,"The power supply plugs into the left rear side of the laptop instead of the back. There are 4 USB ports with 1 being exactly where the mouse pad and mouse are located. The keyboard has a very ""hard feel"" instead of the easy touch of my other Dells. I got it at a good price, but am not happy. I do love the performance and wanted WIndows 7 OS instead of WIndows 8.",To be derived,To be derived,To be derived,To be derived,To be derived,,,
Inspiron 15,ecommerce Website,16/11/2013,4/5,"This was a wise purchase, a good value, easy to get used to,and performs well. It also arrived several days ahead of schedule.",To be derived,To be derived,To be derived,To be derived,To be derived,,,
Inspiron 15,ecommerce Website,22/11/2013,4/5,"I recently purchased a new laptop, the Inspiron 15. I thought it would be a new version of my old Inspiron which needs percussive therapy every time we turn it on to get the screen to engage.
Silly me. Things are never the same. And why should they be when tweaks to hardware and software are available.
It seemed intuitive to me that I should order Windows 8. Isn't it obvious that it would be better than the previous version? Not. I hate that operating system. I wanted a computer not a large app device.
And it turns out the new computer is much heavier.
So after much hemming and hawing decided to return it. Well I was four days over the 30 return policy. Yes I know I should have checked that, but there was the whole holiday travel thing in there as well.
So alas, I have a heavy laptop with an obnoxious operating system that we don't want.",To be derived,To be derived,To be derived,To be derived,To be derived,,,
Inspiron 15,ecommerce Website,17/11/2013,4/5,Good for the Price. IT has all the basic Feature you need.,To be derived,To be derived,To be derived,To be derived,To be derived,,,
Inspiron 15,ecommerce Website,14/11/2013,4/5,This computer does not have an optical drive or CD drive. Very disappointed in this computer,To be derived,To be derived,To be derived,To be derived,To be derived,,,
Inspiron 15,ecommerce Website,20/2/2014,5/5,"I knew that an I3 chip based laptop would not be that fast running windows 8 - but this is really bad, application take forever to open and windows 8 just run slow. Everything seems to work --- just very very slowly. If I could I would return this laptop today for something that performs at a reasonable speed as a 6 time dell computer owner this is the worst by far...",To be derived,To be derived,To be derived,To be derived,To be derived,,,
Inspiron 15,ecommerce Website,15/2/2014,5/5,"The Windows 8 operating system is designed for social media, but not for business applications. If you desire a toy, this computer will meet your needs. It does not function with serious business software, and is almost impossible to upgrade to Windows 7 Professional.",To be derived,To be derived,To be derived,To be derived,To be derived,,,
Inspiron 15,ecommerce Website,14/2/2014,4/5,Do not buy Dell Laptop as part quality is not good and get failed soon and upon it extended warranty package cost too much..,To be derived,To be derived,To be derived,To be derived,To be derived,,,
Inspiron 15,ecommerce Website,12/2/2014,3/5,I thought I was buying a touch screen as I selected all the drop down menues and tabs indicated as I was making my purchase. But then putting up with windows 8 has been a night mare. The charms bar pops up as you are in the middle of the page! then it will not go away. I tried the fix key and that down not work. I want to throught this laptop at the wall. What a mistake.,To be derived,To be derived,To be derived,To be derived,To be derived,,,
Inspiron 15,ecommerce Website,10/2/2014,4/5,"Having problem staying online, constantly timing out. I have three other devices and none of them have this problem. Not crazy about Windows 8, but will give it more time. I feel they tried to dumb it down and just made it more complicated.",To be derived,To be derived,To be derived,To be derived,To be derived,,,
Inspiron 15,ecommerce Website,6/2/2014,1/5,t is pretty slow but it works. Battery life is okay. I wouldn't plan on playing games with this machine. Can't install windows video editor because it doesn't meet minimum machine requirements. First time with windows 8 and hate it. Maybe it would be a little better with touch screen.,To be derived,To be derived,To be derived,To be derived,To be derived,,,
Inspiron 15,ecommerce Website,1/2/2014,2/5,The laptop runs slowly. Websites take a while to load and seems delayed. The scroll down button doesn't always scroll down. The swipe from the corner doesn't always show up. May be returning this laptop.,To be derived,To be derived,To be derived,To be derived,To be derived,,,
Inspiron 15,ecommerce Website,1/2/2014,5/5,"Very clunky, cheesy keyboard and no touch screen as advertised",To be derived,To be derived,To be derived,To be derived,To be derived,,,
Inspiron 15,ecommerce Website,28/1/2014,5/5,"Product is good for the money. However not a fan of ""chicklet"" keyboard which feels light and very cheaply made. Otherwise it does what I need it to do. I do wish dell would consider where they place power and printer plugs. They really should be in the back, otherwise you end up with wires coming out of sides of laptop and hindering viable desk space on sides of the laptop",To be derived,To be derived,To be derived,To be derived,To be derived,,,
Inspiron 15,ecommerce Website,23/1/2014,1/5,"It's a very small laptop, so small that if you barely touch the mousepad with your wrist the screen will jump all over the place. Very inconvenient to type on, but good to watch some online shows where space is limited. Do love that it is so light weight.
Overall not too bad, but the mousepad is a nightmare.",To be derived,To be derived,To be derived,To be derived,To be derived,,,
Inspiron 15,ecommerce Website,22/1/2014,2/5,"Received my new laptop today and it is brilliant!! I got the one with 6GB ram and 1TB hard drive and it is so fast.
Windows 8 has taken a bit of getting use to but easy to pick up.
Excellent laptop for a great price only problem is that the buttons on the mouse pad are loud when you press them but that's not such a big problem.
I Would recommend this product!",To be derived,To be derived,To be derived,To be derived,To be derived,,,
Inspiron 15,ecommerce Website,22/1/2014,4/5,Great computer! The only downfall is the battery life. It only lasts 4-5 hours and then needs to be plugged in.,To be derived,To be derived,To be derived,To be derived,To be derived,,,
Inspiron 15,ecommerce Website,22/1/2014,1/5,"I needed a basic laptop to handle my business needs and maybe a little personal stuff as well from time to time. This fit my needs. I am having a little bit of an issue with the touch pad. I have had to reset it 4 times because it is way to sensitive and keeps resetting itself to factory default after a reboot. The other problem with it is the black trim around the keypad is trash. It keeps popping out of the locks that hold it in place.
Though not Dell's problem Windows 8 has frozen up on me several times and most of the problem there is because of IE 10. I hate it and use chrome now.
Overall the laptop so far is doing the basic job I need it for and that is to handle sales, inventory, and email. I would not recommend this for a power user or someone who wants to do heavy internet usage.
The power button does not light up to show you are on or not. Also the power cable plugs in on the left side. Wish it had been centralized out the back for more convenience.",To be derived,To be derived,To be derived,To be derived,To be derived,,,
Inspiron 15,ecommerce Website,12/1/2014,4/5,"have received my Dell Laptop today, all is great except it does not have the touch screen facility. On looking again is clearly states it has 'optional touch screen' facility included, when in fact is isn't. This is very misleading and there is no-where visible to actually add this feature as a 'paid extra'. I took 'optional' as meaning you either have it switched on or off. Have tried ringing Dell today, on phone for 38 minutes, transferred at least 9 times to different assistants and after repeating myself each time, gave up. Feel a bit disappointed.",To be derived,To be derived,To be derived,To be derived,To be derived,,,
Inspiron 15,ecommerce Website,9/1/2014,1/5,"I had been running a 5/6 year old Inspiron 1520 into the ground - it was so broken that I had the lid gorilla-glued to box lid hinges to keep it open - so my requirements for a new laptop weren't super high just to give you a frame of reference.
I got the i3-3227U version and this little bugger seems pretty nice for the price for me. I am liking the ribbed (haha - or whatever) material on the outside and the light weight. Seems pretty fast for just about everything I need - a little web development as well as common usage.
I am a casual gamer, but I am usually playing stuff about 3-5 years behind its release, and this thing is pretty much smoking for that. Fallout 3 is running nicely on high settings. The Intel HD 4000 card did not disappoint (for me as a behind-the-times gamer). And I have had it on my lap while playing and not gotten any lapburn or even felt much of a temperature rise
Gripes are that the keyboard will need some getting used to - the arrow keys are pretty small and home, delete, etc are also. My little touchpad looks like it has greasemarks on it already (I am not that greasy of a guy), but nbd! Oh and I really will have to get a wireless mouse because I am a righty and the USB port on the right side is toward the front for a wired mouse because the wire gets rolled over by the mouse.",To be derived,To be derived,To be derived,To be derived,To be derived,,,
Inspiron 15,ecommerce Website,16/10/2013,1/5,"I thought I wasn't going to loveit much but I absolutely love it. It's efficient and works well, everything seems organized and my Internet or my wifi are both working great with speed. Still learning new things about it but I love it. The pricing wasn't enough for this. It's a lot more manageable than I thought it would be.",To be derived,To be derived,To be derived,To be derived,To be derived,,,
Inspiron 15,ecommerce Website,1/1/2014,1/5,I have brought this Laptop on 12/04/2013 From the Dell Exclusive store. Its an Awesome laptop but its CPU is not so powerful. It is an i3 CPU with a clock speed of 1.40GHz which is not enough for me because I like to play some games on it which I can't because the Windows 7 itself takes 800MHz for its own purpose and the left is eaten by the McAfee. So its an awesome Laptop except the CPU is not powerful.,To be derived,To be derived,To be derived,To be derived,To be derived,,,
Inspiron 15,ecommerce Website,31/1/2014,1/5,I love using this computer for everything. Would love it even more as soon as I figure out fully how to operate it.,To be derived,To be derived,To be derived,To be derived,To be derived,,,
Inspiron 15,ecommerce Website,13/4/2013,1/5,"I have bought this laptop for working with Office programs, Adobe InDesign, Photoshop and other programs. Also for Internet and other light tasks. Laptop totally corresponds my expectations. And the battery is good, with battery saving soft and battery life prolonging suggestions.",To be derived,To be derived,To be derived,To be derived,To be derived,,,
Inspiron 15,ecommerce Website,17/7/2013,3/5,"I have always been a Dell customer and thought that was a good thing, but I find it difficult to understand how 2 of the same Laptops could be so different. One has worked well since I got it and the other purchased at the same time has been nothing but problems. It has run very hot since I bought it and now it is at the point that it just continues to power off with limited use. The other one continues to work ok.
If you are looking for something with good battery life then I would not recommend a Dell Laptop. They are poor in that respect in my opinion.",To be derived,To be derived,To be derived,To be derived,To be derived,,,
Inspiron 15,ecommerce Website,29/12/2013,3/5,"I have the cheap model of Inspiron 3521. After I installed the newest drivers very satisfied with it, it is a good machine for the price. I connected it to my 24"" Dell monitor with an HDMI cable, so I can use it for photo editing too. Latest Photoshop is running perfectly on it. If you have not much money and aren't a gamer, I can recommend this notebook for you.",To be derived,To be derived,To be derived,To be derived,To be derived,,,
Inspiron 15,ecommerce Website,31/12/2013,3/5,I BEEN A DELL LAP TOP USER FOR THE PAST 7 YEARS AND I LOVE IT AND ALL THE SUPPORT I GET FROM DELL!!!,To be derived,To be derived,To be derived,To be derived,To be derived,,,
Inspiron 15,ecommerce Website,2/1/2014,3/5,Had a small problem with the shutdown button under the charms. Luckily I only had the computer for a week and no major things saved to the computer after that everything works.,To be derived,To be derived,To be derived,To be derived,To be derived,,,
Inspiron 15,ecommerce Website,9/1/2014,3/5,"Surprisingly quick startup for a relatively inexpensive laptop. Plenty of storage. Decent graphics. It's very quick in opening programs and such. Clear, bright display. It has two USB 3.0 ports, which is a great thing for a laptop this inexpensive. So much faster. The only two negatives that I see are that the power cord sticks straight out of the side. They could have made the plug at 90 degrees, which would be flush. The other is the fact that it doesn't come with recovery media. You can create your own, but it's still not the same as actually having the Windows 8 Pro OEM disk. I like to freshly install the OS about once a year, then choose which programs to install afterward. You can't do that with this. If I'm paying for an OS, I should get the disk. Other than those two things, this is a great machine and well worth the money. It's not for high end games and graphics intensive things, but it's great for what it is designed for.",To be derived,To be derived,To be derived,To be derived,To be derived,,,
Inspiron 15,ecommerce Website,21/1/2014,3/5,This is a good laptop for all your needs from using additional software like the Microsoft Office suite to the internet.,To be derived,To be derived,To be derived,To be derived,To be derived,,,
Inspiron 15,ecommerce Website,27/2/2013,4/5,"I bought this computer for my nephew for school. it was a nice computer for the price..good memory, it's fast for what he needed it for.",To be derived,To be derived,To be derived,To be derived,To be derived,,,
Inspiron 15,ecommerce Website,3/4/2013,4/5,Very nice platform for Windows 8. I miss not having a lighted keyboard and the case shows finger prints pretty well. Overall it is a nice computer for a budget price.,To be derived,To be derived,To be derived,To be derived,To be derived,,,
Inspiron 15,ecommerce Website,4/4/2013,4/5,"Purchased this on line direct from Dell. It shipped very quickly and arrived in good shape. I was easy to immediately begin using it. Learning WIndows 8 is a challenge to some extent but the laptop itself is great, portable, and the keyboard has a nice touch.",To be derived,To be derived,To be derived,To be derived,To be derived,,,
Inspiron 15,ecommerce Website,5/4/2013,4/5,"When you order a Dell, you know what you're getting. This laptop was no exception. It's a good, steady machine.",To be derived,To be derived,To be derived,To be derived,To be derived,,,
Inspiron 15,ecommerce Website,8/4/2013,4/5,"The side connection are not the best way, prefer rear connections.",To be derived,To be derived,To be derived,To be derived,To be derived,,,
Inspiron 15,ecommerce Website,11/4/2013,4/5,"This is my second dell laptop and so far I am very happy with this one. I love the size and how thin it is. I also really like how quiet it is. I did have some trouble with my cd/DVD drive not working but it seems to be working fine now. Overall, I think it's a great laptop and it suits my needs perfectly.",To be derived,To be derived,To be derived,To be derived,To be derived,,,
Inspiron 15,ecommerce Website,15/4/2013,4/5,I would not trust another brand but Dell. The product is good for everyday use.,To be derived,To be derived,To be derived,To be derived,To be derived,,,
Inspiron 15,ecommerce Website,5/5/2013,4/5,The speed is okay for everyday. It will hang once in while. The battery last very long. The touch pad is working alright although it has that oily look very fast once you start using it.,To be derived,To be derived,To be derived,To be derived,To be derived,,,
Inspiron 15,ecommerce Website,15/7/2013,4/5,"This laptop came with Windows 8 and I upgraded to 8.1 with no trouble. There were no problems with both versions of windows. I have used computers since the Timex ZX80 and can say it is a great laptop. The only drawback is the textured surface which shows hand prints wherever it is touched. By the way the touch screen is handy but a wireless mouse is better than the touch pad. the third edition cpu is fast enough for a laptop, will we ever be satisfied with the speed, no matter how fast.",To be derived,To be derived,To be derived,To be derived,To be derived,,,
Inspiron 15,ecommerce Website,25/6/2013,2/5,"I am no stranger to Dell as this is our 3rd laptop direct from them.
Our last Dell studio is still going strong, but I needed something with a little more punch for testing out component designs at home.
Laptop arrived in less than 2 days from order, which was better than expected. I opened it up and plugged in the power and away it went - no problems at all.
Windows 8 is a peculiar one at first, but I sat down and went through the instructions 'Getting Started with Windows 8 on your new Dell' that are provided. It's good that Dell had the forethought to include this and now I think Windows 8 is superb!
The keyboard is a pleasure to use and the keys soft but still definite in operation, with the annoying gaps between closed off, saving the inevitable collection of biscuit crumbs that cause malfunction. The separate keypad is a real bonus too.
Operating wise, it's fast to wake up, though I've yet to find a quick way to sleep - I'm sure it will be there somewhere and I just need to find it. It's nice and fast to open programs and not found anything it couldn't cope with doing.
The only thing I really don't like is that the plastic trim around the case just feels a little bit too cheap & nasty. Time over again, I'd pay a bit more and get the metal trimmed option, but the same spec 15R wasn't available until the end of Jan 2014. If you can wait do so, but unfortunately I needed to get stuck into things within the week so time was against me. Would I have one again though? - Yeah, definitely!",To be derived,To be derived,To be derived,To be derived,To be derived,,,
Inspiron 15,ecommerce Website,26/5/2013,4/5,I use it as a back-up and sync it to my Alienware desktop and take it on the road with me. No difference in performance between the two machines.,To be derived,To be derived,To be derived,To be derived,To be derived,,,
Inspiron 15,ecommerce Website,24/4/2013,5/5,It's a great machine. Work Well and give me 100% satisfaction.,To be derived,To be derived,To be derived,To be derived,To be derived,,,
Inspiron 15,ecommerce Website,11/4/2013,5/5,Easy start up / set up. Just needed a laptop for some low maintenance stuff on the go. Purchased esp. because I could still get it with Windows 7.,To be derived,To be derived,To be derived,To be derived,To be derived,,,
Inspiron 15,ecommerce Website,25/9/2013,4/5,"Thankfully, Dell understands that Windows 8 is NOT RIGHT for everybody. So happy with my Dell with Windows 7 !!! I tell everyone to shop Dell FIRST.",To be derived,To be derived,To be derived,To be derived,To be derived,,,
Inspiron 15,ecommerce Website,19/11/2013,4/5,"This is one great laptop and a great deal. I see allot of reviews saying haw bad windows 8 but it just takes a little getting use to, once you know how to use the feature it has it works great. Though I did not get the touch screen and should have for windows 8",To be derived,To be derived,To be derived,To be derived,To be derived,,,
Inspiron 15,ecommerce Website,19/11/2013,4/5,I ordered this computer and I just love it. Was very skeptical of purchasing a computer with Widows 8 because I had heard terrible things about it. Computer is very user friendly and I have become very comfortable with using it. I would highly recommend this computer to others. I will most definitely purchase things from Dell before I look elsewhere.,To be derived,To be derived,To be derived,To be derived,To be derived,,,
Inspiron 15,ecommerce Website,19/11/2013,4/5,Have had no problems....love the machine! Enjoy the speed...the touch screen...and overall display,To be derived,To be derived,To be derived,To be derived,To be derived,,,
Inspiron 15,ecommerce Website,19/11/2013,4/5,I thought I would want a larger laptop but this one is just right. very manageable and easy to use. I recommend this one for home and office use to anyone.,To be derived,To be derived,To be derived,To be derived,To be derived,,,
