Product,Source,Source Date,Rating,Customer Verbatim,Quality Impact,Loyalty,Purchase Decision,Root Want,Sentiment,Features,Opinion Sentence,Loyalty Param
Inspiron 15,ecommerce Website,20/5/2013,4/5,"I have had this laptop a good few weeks now, tested it fully and know the positives and negatives. I have been purchasing systems only from Dell for 6 years, hopefully my review will help you out.Nice sleek, thin and comfortable designed laptop- the casing is very nice ridged texture that looks and feels brilliant. It does accumulate finger prints but nowhere near the level other systems do. It's also light weight. Screen is nice and wide, perfect for work, gaming and browsing the web. It has a glossy glare which is really nice, easy to clean and good quality. Bright and details are great. The Keyboard is perfect, easy to clean, stylish, nice quality feel and durable. Remember, black absorbs heat and makes it fade. Unfortunately I left mine in the sun and the keys have faded (that is my fault not the product) I'm still looking to find a replacement, would be great if I could be directed. Trackpad feels great, very responsive and easy to use. Left and right clickers (I made that word up) are very nice and feel like they're built with quality. However, sometimes the mouse freezes for anywhere up to 40 seconds when opening numerous programs or running scans. This does get a little bit frustrating especially knowing it's an i3 processor. The palm rest has a sharp-ish edge on it, but I'm sure that will wear down with use. I would say it lacks a bit of performance as it should load easy tasks in seconds, it does not always respond when I ask it to and some applications fail to load as quick as they should. Most of the time it works perfectly, it laggs very rarely. Intel HD Graphics is an integrated graphics card that is basic but still very good. I play a standard browser based MMO that runs at 40-45 out of 50 Frames Per Second, for me that is very good. It also handles some games well such as Skyrim, Dirt and Farcry at medium graphics.Audio is great, very loud and clear.Webcam is very nice, perfect for streaming, very high detailed with no 'jittering. Ports are good, the HDMI works perfectly and looks great with my TV. AC adapter is Standard yet very durable and lightweight. Windows8 isEasy to use, quickly able to adapt from taking a first time leap from XP all the way to the newest OS. At first I was a bit pessimistic, but I'm very happy with it's design, features and ease of use. Service and delivery was great from Dell as usual. A very satisfied customer and I won't fail to recommend this product. Cons:Disk tray is flimsy and not very well built when open, it still performs well. The casing on the front of the screen (trim where the webcam is) feels 'plasticy, weak and cheap, the back is ridged and a nice design though. Overall rating from me, 8/10. Some mildly rough patches but still a great system, the price is very decent for what you're getting.",To be derived,To be derived,To be derived,To be derived,To be derived,"laptop,screen,keyboard,trackpad,mouse,i3 processor,graphics card,Intel HD Graphics,Audio,Webcam,Port,HDMI,AC adapter,windows8,
service,delivery,Dell,customer,Disk tray,casing,screen,price,keys.","1)Nice sleek, thin and comfortable designed laptop- the casing is a very nice ridged texture that looks and feels brilliant.
2)Screen is nice and wide, perfect for work, gaming and browsing the web.
3)The Keyboard is perfect, easy to clean, stylish, nice quality feel and durable
4)Trackpad feels great, very responsive and easy to use.
5)However, sometimes the mouse freezes for anywhere up to 40 seconds when opening numerous programs or running scans.
6)This does get a little bit frustrating especially knowing it's an i3 processor
7)Intel HD Graphics is an integrated graphics card that is basic but still very good
8)Audio is great, very loud and clear.
9)Webcam is very nice, perfect for streaming, very high detailed with no 'jittering'.
10)Ports are good, the HDMI works perfectly and looks great with my TV.
11)AC adapter is Standard yet very durable and lightweight.
12)Windows8 isEasy to use, quickly able to adapt from taking a first time leap from XP all the way to the newest OS.
13)Service and delivery was great from Dell as usual.
14)A very satisfied customer and I won't fail to recommend this product
15)Disk tray is flimsy and not very well built when open, it still performs well.
16)The casing on the front of the screen (trim where the webcam is) feels 'plasticy, weak and cheap, the back is ridged and a nice design though
17)the price is very decent for what you're getting.
18)Unfortunately I left mine in the sun and the keys have faded (that is my fault not the product) I'm still looking to find a replacement.","few weeks,6 years,"
Inspiron 15,ecommerce Website,25/3/2013,4/5,"I like this laptop because it is cheap, light weight, and seems to have a good performance, except one problem that I am considering to return. The first time I turned it, there was a loud sound of the fan or the hard drive ( I am not sure). I hoped it would stop after few minutes, but it didn't. Now every time I turn this laptop on, this sound bothers me, especially when I use the laptop in a quiet place. Can someone help me to fix this problem so I don't have to return it? Thanks.",To be derived,To be derived,To be derived,To be derived,To be derived,,,
Inspiron 15,ecommerce Website,20/2/2014,5/5,"Like a desktop away from your desktop. I use the Inspiron for all my computing needs, the non-touch is definitely worth the money, and that extra hundred for touch is preference. It has common durability. Get Windows 8 pro for the extra security (Bitlocker), extra speed, and accessibility. It feels like a small desktop, and ironically has more storage than my Windows 7 Gateway. Dell is definitely the way to go for laptops. Pros:lots of space, wide screen, thin screen, fast start upCons:no right-click button, wide screen, thin screen, not a lot of memory for gaming.",To be derived,To be derived,To be derived,To be derived,To be derived,,,
Inspiron 15,ecommerce Website,17/2/2014,3/5,"The on screen keyboard pops up when u don't ask it to-I didn't buy a tablet I don't need it. Annoys you to upgrade to 8.1 and when you do you have to get new Bluetooth drivers.Once you upgrade to 8.1 it tells you to upgrade the BIOS this will ruin your Hard Drive and they have to replace the computer or send someone to replace the Hard Drive and they do not extend the Warranty when all they do is send someone so DO NOT UPGRADE THE BIOS! Doing so will break the computer. Everything will run slow and give errors and do lots of weird stuff. The scan they have you run will come back fine after getting stuck around 98% for a long time and they try to put you off by not calling when they said and giving a super long wait time when you call back, Stay on the line! They will run a scan by downloading their own scan onto the computer and see that the Hard Drive is bad. I wish they had sent it with 8.1 to avoid this and would check their updates before releasing them. They need to replace the whole thing and extend the warranty if they are going to release updates that break the computer!-very disgruntled.",To be derived,To be derived,To be derived,To be derived,To be derived,,,
Inspiron 15,ecommerce Website,14/2/2014,4/5,We were looking for a laptop to add to our business. This one provided what we needed for a good price.,To be derived,To be derived,To be derived,To be derived,To be derived,,,
Inspiron 15,ecommerce Website,13/2/2014,2/5,"My laptop started experiencing scree/display problems within the first week. It appears pixels have stopped working in a small portion of the screen. Its small but becomes extremely annoying when watching a movie or trying to do work and there's a small blotch in the middle of someone's face. Pros:works well,fast Cons: manufacturer defect.",To be derived,To be derived,To be derived,To be derived,To be derived,,,
Inspiron 15,ecommerce Website,13/2/2014,1/5,"You get what you pay for and this is not an expensive machine. I bought 2 but only opened one. Windows 8.1 can only be downoaded by removing an installed update. It takes ages to open some tiles, sometimes up to 30 sec. The recommended memory for this product according to Dell is larger than the 4gb they supply so why do they do that? Keyboard has cheap feel and being black on black its very difficult to see. Wanted to upgrade the one i had used for a few days and return the one i had not even opened but due to only 7 day return period Dell refuse to have either of them back. I have 2 expensive bookends. Buyer beware(hide) Pros:touch screen Cons:too slow, memory to small for os, keyboard almost invisible, graphis poor when streaming, finger mark.",To be derived,To be derived,To be derived,To be derived,To be derived,,,
Inspiron 15,ecommerce Website,13/2/2014,4/5,"Bought the Inspiron to replace ~10 year old Dell desktop - had not realized the prices for laptops had reached such levels. Only a month in, but quite pleased from an overall perspective. Windows 8 has offered its challenges, but as we learn the 'tricks', it's getting much more friendly. The sturdiness of the unit is great, and as others have mentioned the keyboard is fantastic (so nice to get away from the soft keyboards of other products). Maybe not as fast or feature rich as higher priced laptops/desktops, but suits our purpose as a basic machine. Excellent price/performance ratio",To be derived,To be derived,To be derived,To be derived,To be derived,,,
Inspiron 15,ecommerce Website,2/12/2014,4/5,"MY FRIST INSPIRON WINDOW VISTA I HAD IT FOR 10 YRS WITH OUT KNOW PROBLEMS , SO MY SON GOT US THIS INSP.. 15 WHEN I TOLD HIM IT WAS THE BEST PC I EVER HAD , HE GOT HIM ONE AN IN 2 YRS HE GOT US THIS ONE AN SENT US HIS LOVE AS HE LOVE THE DELL PERFROMICE , AN THAT HOW WE GOT ARE NEW PC .. FROM THE HARD WORKING DELL PC LAP TOPS .../ THANK YOU DELL FOR THE FINE PCs YOU OFFER US",To be derived,To be derived,To be derived,To be derived,To be derived,,,
Inspiron 15,ecommerce Website,2/10/2014,4/5,This laptop is much lighter than my last one. I have had no problems so far but have always found that customer service with Dell was so easy to access. This has everything that I need and at a decent price.,To be derived,To be derived,To be derived,To be derived,To be derived,,,
Inspiron 15,ecommerce Website,2/7/2014,4/5,"I think that this computer is fun to use and easy to use Pros:so easy to learn to use, light weight",To be derived,To be derived,To be derived,To be derived,To be derived,,,
Inspiron 15,ecommerce Website,2/7/2014,4/5,"Got this for our family. It is a very good entry level non-touch laptop for people who only use it for email, homework, and web browsing. It's design is clean and easy for people who prefer traditional tower PCs. Picture is sharp. Still getting used to Windows 8 UI. Don't think Tiles will go far. Pros:ease of use Cons:no cd/dvd-r, memory stuck at 4gb max.",To be derived,To be derived,To be derived,To be derived,To be derived,,,
Inspiron 15,ecommerce Website,2/6/2014,3/5,"Unfortunately, I did not start using my computer in time to realize that I did not like it, or I definitely would have returned it. The operating system is great, and basically everything about the computer is good, except for the loud touch pad. This may make a great computer for a high school student, or a college student, but not for someone who does not want a loud clicking sound from the touch pad disrupting meetings. Other than that, it's not a bad buy. It's my third Dell purchase, and probably my last.(hide)Pros:inexpensive, good operating system Cons:loud touchpad that is a design flaw.",To be derived,To be derived,To be derived,To be derived,To be derived,,,
Inspiron 15,ecommerce Website,2/6/2014,4/5,"This is perfect laptop for everyday use. I got this for my mom, she knows enough to get the job done. Windows 8 has a little learning curve but it's nice. Right out of the box upgraded to Windows 8.1, much better. Touch pad is nice but uses a wireless mouse instead",To be derived,To be derived,To be derived,To be derived,To be derived,,,
Inspiron 15,ecommerce Website,2/6/2014,1/5,have inspiron 15 3521.Buy in sep 2013 but in short time screen in problem generate pixels line display on the screen.and process is very slowly work.i5 prcessor but that speed is very slow speed is comparable with core2duo processor.,To be derived,To be derived,To be derived,To be derived,To be derived,,,
Inspiron 15,ecommerce Website,2/6/2014,4/5,Computer is great for schooling and gaming at an affordable price.,To be derived,To be derived,To be derived,To be derived,To be derived,,,
Inspiron 15,ecommerce Website,2/6/2014,4/5,Can't beat the deal on this lap top. Glad I made the purchase.,To be derived,To be derived,To be derived,To be derived,To be derived,,,
Inspiron 15,ecommerce Website,2/3/2014,4/5,"This laptop makes the high-pitched noises from beneath the keyboard. Pros:stylish - thin shiny and light, good keyboard, ips screen - wide view angle, build quality - sturdy Cons:glossy screen - glare and reflaction, lack of ports - no hdmi sd slot ethernet port, expensive, no os disc driver disc, cheap speaker sound, battery life - 4~5 hours",To be derived,To be derived,To be derived,To be derived,To be derived,,,
Inspiron 15,ecommerce Website,2/12/2013,4.5/5,"With a full HD screen and Haswell, this Ultrabook combines great visuals with better performance and battery life. The keyboard is great with plenty of travel. The white keyboard backlight is bright and of high quality. The build quality and design are unrivaled. Up to 8 hours of web browsing can be expected on around 50% brightness. There is no SD card reader, however, although an USB to SD card adapter would be fine. The same could be said for the lack of HDMI, where a Mini Display Port to HDMI adapter would be good enough. This really is the XPS 13 perfected, although the price could set it back slightly.Pros:great design and build quality,great screen, haswell - better battery life, great keyboard. Cons:no sd card reader, price slightly high.",To be derived,To be derived,To be derived,To be derived,To be derived,,,
Inspiron 15,ecommerce Website,2/9/2013,4/5,"Had the laptop for less than 1 hour and sending it back, horrible screen bleeding on the bottom and sides the worst I have ever seen!! The track pad was so loose I thought it was going to fall off. Do they not check them for quality or is this just a one off? Will never buy another Dell again. Cons:screen bleeding, loose track pad.",To be derived,To be derived,To be derived,To be derived,To be derived,,,
Inspiron 15,ecommerce Website,2/6/2013,4/5,"I would recommend this product.Excellent Performance and Great design, Extremely Fast boot up, Battery Life is decent, Touch screen is excellent, Slim and sleek.Though 128 GB SSD was mentioned by Dell, I actually received 61GB(showing 61 GB free of 103 GB).Overall, This is a great product.",To be derived,To be derived,To be derived,To be derived,To be derived,,,
Inspiron 15,ecommerce Website,2/3/2013,4/5,"I've had several Dell Desktops and a couple Laptops over the years. All have been very good. My last dell was the XPS 14 ultrabook and it was very good except I had some overheating problems, yet I had bought it as a ""refurbished"" from the Dell Outlet, knowing chances you take with such purchases. Like I said, other then that the XPS14 computer was very good, but I decided to sell it and try one more time with a Dell Product, even though I had it repaired by Dell...... The good news???? I purchased the Dell XPS 13 with the new 4th generation chip and had to have the backlit keyboard as from using that feature on the xps14. I also choose windows 7 because I do not like windows 8. It took nearly three weeks to get my order but it was worth the wait and suspense. THIS new XPS 13 computer ROCKS!!!!! Words can describe it. It really is the PERFECT computer I've dreamed about for years. Better then Apple Mac Air in my opinion. Computer is lightweight, incredibly mobile, FAST, stylish, I could on and on.....YOU will not be disappointed. Even the old windows 7 seemed new and improved the way it ran on this system. I am a very HAPPY customer and I think Dell has hit a new bulls eye with this one. All they need to do is get the word out. Since owning this, I have almost forgotten to use my iPad4. I now use the iPad mainly only for photos, since I call it my ""flat camera"" Pros:very fast, lightwight, fast bootup time, backlit keyboard, very mobile, easy to grip and stylish, runs cooler than other laptops i've had.",To be derived,To be derived,To be derived,To be derived,To be derived,,,
Inspiron 15,ecommerce Website,2/12/2012,4/5,"I am very pleased with this purchase. I have owned 4 dell laptops, 2 fantastic, 2 sucky. This is my fifth and it is fantastic. Great build quality and performance, quiet, cool, long battery life, and plenty of horse power.",To be derived,To be derived,To be derived,To be derived,To be derived,,,
Inspiron 15,ecommerce Website,2/9/2012,4/5,"This is the perfect Ultra book out there. Dell has always made excellent computers. The Dell XPS 13 is great. It is fast, durable, and high-end. This PC boots up in just seconds and it is extremely quiet. Perfect for students although it is pretty pricey however this PC excels in everything and it is well worth it. Not even a Mac comes close to the Dell XPS 13. I highly recommend this PC to everyone. The Dell XPS 13 is the perfect Ultra book. Pros:slim, durable, quiet, build quality, light weight, fast.",To be derived,To be derived,To be derived,To be derived,To be derived,,,
Inspiron 15,ecommerce Website,2/5/2014,4/5,"I'm a long time Dell user, and this INSPIRON 3521 laptop is the tenth Dell I've brought home. My daughter's older laptop finally gave up the ghost--after six grueling years of college--so I replaced it with this honey. She couldn't be happier! It does everything she'd want it to do for schoolwork, and then some--surfing the web, writing papers, listening to music, streaming videos, using Skype, and considerably faster than her older model. Keep up the good work, Dell. You haven't disappointed us yet!(hide) Pros:great price, lightweight, lots of features, windows 7.",To be derived,To be derived,To be derived,To be derived,To be derived,,,
Inspiron 15,ecommerce Website,2/4/2014,4/5,"I have been using the laptop daily, it's fast and extremely easy to use and get accustomed to.",To be derived,To be derived,To be derived,To be derived,To be derived,,,
Inspiron 15,ecommerce Website,2/4/2014,4/5,I have a desktop and pad but was looking for something that I could use when I travel and sitting at home and playing games while watching TV but I did not want to spend a lot of money. My new Inspiron fits the bill.,To be derived,To be derived,To be derived,To be derived,To be derived,,,
Inspiron 15,ecommerce Website,2/4/2014,4/5," I decided to get a laptop to use for home, hooked up to my old keyboard and mouse as I have trouble w the laptop keyboards. While it is a bit unwieldy to use the start up function and the wires needed, once it is up and running, it is nice and fast. Also, the image is super clear - whether streaming on line or using the various software on the machine.",To be derived,To be derived,To be derived,To be derived,To be derived,,,
Inspiron 15,ecommerce Website,2/5/2014,4/5,"This computer is just what my family has been needing. It does all the things we need it to do. Email, browsing the internet, etc. We've had it just over 2 weeks now and have not found a thing we do not like. Dell came through for us again!",To be derived,To be derived,To be derived,To be derived,To be derived,,,
Inspiron 15,ecommerce Website,2/5/2014,4/5,This is probably the 5th laptop I have bought from Dell in the last 3 years. This is the first windows 8 laptop that I bought that I like. The touch screen is awesome,To be derived,To be derived,To be derived,To be derived,To be derived,,,
Inspiron 15,ecommerce Website,31/1/2014,4/5,"I like the size, it is lightweight, pretty fast on start up and connecting to web pages. So far I have had no problems with anything. This is my first laptop so I need to get used to the keyboard. I feel this is a great product for the cost.",To be derived,To be derived,To be derived,To be derived,To be derived,,,
Inspiron 15,ecommerce Website,31/1/2014,3/5,Solid computer except for the screen which cracked after 6 months of use when opening the computer. Installed cost of replacement is more than 50% of the computers cost and cracked screen is not covered under warranty.,To be derived,To be derived,To be derived,To be derived,To be derived,,,
Inspiron 15,ecommerce Website,30/1/2014,0.8,"This Dell computer does not have a scroll bar on the touch pad.without a mouse it makes moving around the screen so much slower. Also, something was wrong with the original set up-did not configure admin account and the disk drive wouldn't work. Had to call cust. service to reconfigure the set up. Took a long time, but they did a great job and it works well now. Pros:faster than my old vista. Cons:doesn't have scroll capability on touch pad.",To be derived,To be derived,To be derived,To be derived,To be derived,,,
Inspiron 15,ecommerce Website,30/1/2014,4/5,"For a mid-range business laptop, or for most personal use, this is definitely a good quality laptop. The case feels quite a lot more durable than the less expensive options, has great access to all ports, and runs very quietly. A laptop that can actually work both as a laptop or as a desktop replacement solution so well is rare. The keyboard has also been extremely easy to get used to, compared to many other laptop keyboards out there. I even find myself using the trackpad more frequently than I had on prior laptops due to annoyances with odd behavior.Also, excellent sound for a laptop. Pros:great sound quality, good case design, good input Cons:slow hard drive",To be derived,To be derived,To be derived,To be derived,To be derived,,,
Inspiron 15,ecommerce Website,29/1/2014,0.8,"I’ve owned several desktops over the years and this was my very first laptop purchase. I was looking for a simple basic machine that I could take with me to check e-mail, find restaurants/attractions on vacation or watch a movie or play a basic game on the airplane (it’s not a “gaming” machine). However, this little laptop has excelled in all of these plus some more. I’ve installed MS Office and some photo editing software and it performs just fine using these. The 500GB is plenty big enough for anything I’m doing. It’s really thin and lightweight, around 5 pounds. The screen is large and has really good color and contrast as long as you’re right in front of it. The battery life is also pretty darn good. I get about 4 hours of operation out of it watching a couple of movies or general working. It also has 4 USB ports (two 2.0 and two 3.0) and an HDMI port which I thought was kinda cool. Some others I looked at didn’t. The only con I have is that I wish it had come with Windows 7 since it’s not a touch screen. Overall I think it’s one of the best, if not THE best, values for a basic laptop which has several additional nice features. Pros:super thin, lightweight 5 lbs, good battery life, great value Cons:would have rather had windows 7.",To be derived,To be derived,To be derived,To be derived,To be derived,,,
Inspiron 15,ecommerce Website,27/1/2014,4/5,"Bought this for my wife to replace an eMachine Celeron box. Happy with the overall purchase and experience. In the spirit of honesty, I am a DELL services employee and with the discounted price and my employee discount, it was a VERY good purchase. Wife had enough issues moving from XP to Win 7 a few years back so I knew I did NOT want to try to take her to WIN 8. I am using this with a DELL 3.0 HiSpeed USB adapter. I am NOT real happy that there is no power button available with the lid closed. Had to make some changes in placement of PC to accommodate this missing button to be able to leave lid open to access power button. Running it on a DELL 22"" monitor thru the Adapter. Would have liked it to have the micro-connector on the bottom to be able to use an actual docking station, but have made do with the HiSPeed adapter Pros:speed (compared to old machine), like windows 7 and being win 7 64 bit pro even bet Cons:no power buttone accessible with lid closed, noi micro connjector on the bottom for docking station.",To be derived,To be derived,To be derived,To be derived,To be derived,,,
Inspiron 15,ecommerce Website,27/1/2014,4/5,"I simply love this computer. It was my first one with a touch screen and it was very simple to set-up and begin using. I was disappointed that the 8.1 upgrade was not yet installed and that there were dozens of apps already installed that I had to go through and delete. I would have liked to see a tutorial on using Apps and the App store. It would have saved me time overall. I would recommend this system to anyone for a really good all around daily use computer. Especially for the student user. Pros:easy to use, fast and efficient, inexpensive, versitile Cons:too many preloaded apps, no app tutorial on desktop.",To be derived,To be derived,To be derived,To be derived,To be derived,,,
