Product,Source,Source Date,Rating,Customer Verbatim,Quality Impact,Loyalty,Purchase Decision,Root Want,Sentiment,Features,Opinion Sentence,Loyalty Param
Inspiron 15,ecommerce Website,19/11/2013,4/5,"I have had my new laptop a couple of months and I am very happy with my purchase.takes a little getting used to the new windows 8,not bad just different.i woul highly recommend dell laptops and desktops as well.nothing but top of the line products.",To be derived,To be derived,To be derived,To be derived,To be derived,,,
Inspiron 15,ecommerce Website,20/11/2013,4/5,"I like this laptop because it is cheap, light weight, and seems to have a good performance, except one problem that I am considering to return. The first time I turned it, there was a loud sound of the fan or the hard driver ( I am not sure). I hoped it would stop after few minutes, but it didn't. Now every time I turn this laptop on, this sound bothers me, especially when I use the laptop in a quiet place. Can someone help me to fix this problem so I don't have to return it? Thanks.",To be derived,To be derived,To be derived,To be derived,To be derived,,,
Inspiron 15,ecommerce Website,20/11/2013,4/5,"I got the Inspiron 15 back in March 2013 a few months after it came out and have had it now for about eight months. It's a really nice computer. It's the most thin and lightweight computer I've ever had. Windows 8 took a while to figure out but eventually you get used to it. I also had an issue with it always showing fingerprints on the outside and on the mouse pad every time someone touched the laptop when it was new, but I don't really notice anymore the longer I've had it. It is packed full of features. Everything I wanted in a laptop, this laptop has. It has a nice webcam, a big enough screen, nice graphics, tons of apps, large hard drive, nice speakers, spaced out keyboard, numeric pad, several USB ports & external drives, media card reader, long battery life, fast processor, a CD/DVD Drive, doesn't have a loud fan, doesn't heat up that much, smaller/durable computer charger, is very portable, easy to travel with, and has a nice exterior design. I got it for a reasonable price with a discount. After having the Inspiron 15, it's the exact same thing as more expensive and popular laptop brands except way cheaper and very affordable. I definitely don't regret purchasing this laptop and would buy it again any day.",To be derived,To be derived,To be derived,To be derived,To be derived,,,
Inspiron 15,ecommerce Website,20/11/2013,4/5,"Given this laptop for my birthday and exceedingly pleased, windows 8 is fantastic as I gives you the option to go to normal view and the new layout.
The laptop itself is excellent, having used my old dell desktop for the last 10 years, couldn't have hoped for a better laptop
Nice for me to use as a student as I can do everything that I want to do and for my mum who uses it as well, so good to use for all people as you can do a variety of things.
Only thing I would say is that the charge does not last for 7 hours on the go, but other than that fantastic, nice to be able to do tings quickly rather than wait an age to get anything done.",To be derived,To be derived,To be derived,To be derived,To be derived,,,
Inspiron 15,ecommerce Website,20/11/2013,4/5,"Many weeks of watching deals pass me by of touchscreen laptops. I didn't want to spend lot (didn't need financing). I chose the Inspiron 15. So far so good! Windows 8 was really not that hard, BUT different.
I ordered on Monday 3/11 and arrived 3/14, now that is fast delivery.
I have watched several movies and the screen was excellent.
I am attaching some pictures of what is not so great and maybe not a big deal, but I have only used it for 3 days and fingerprints on the touch pad and the outside cover show!
Other than the fingerprints (yes I always wash my hands before I use the laptop), the laptop speed is great. I will upgrade the RAM at a later date.
The only question I am waiting on Dell to answer for me:
Should I get a screen protector for the touch screen? Is the outside cover replaceable (to something that doesn't show a lot of fingerprints)?",To be derived,To be derived,To be derived,To be derived,To be derived,,,
Inspiron 15,ecommerce Website,21/11/2013,4/5,"I find the computer friendly and easy to get around once I got used to windows 8. love the number key pad and how everything is easy to find and exccess. love my computer.
I was able to load software that I already had. it is easy to download from the store.",To be derived,To be derived,To be derived,To be derived,To be derived,,,
Inspiron 15,ecommerce Website,21/11/2013,4/5,"I have 3 Dells in the house, this is the 4rth. All are still working
great.
This Inspiron 15, the touchscreen stopped functioning. I called Dell up, and less than 2 minutes, Dell had to update drivers and I was up and running again. At that time, I had so many question with this new system, Amy at Dell was more than happy to help me resolve all
of my questions. I was on the phone 1 hour with her. Dell stands behind their products, and they have always helped me resolve any issue. I am so glad I have this new Inspiron to work with!",To be derived,To be derived,To be derived,To be derived,To be derived,,,
Inspiron 15,ecommerce Website,23/1/2014,5/5,"I bought my Dell Inspiron N5010 laptop in May of 2011. I haven't had any problems with it. Still using it today. When I was shopping for a laptop I was going to get the cheapes one I could find, but then said to myself why get one that would only last for a little bit then i would have to go and buy anotherone anyway. I have had other dell stuff before, so I know that the price I paid is well worth it. Soon I am going to get me another laptop hear soon and its going to be a dell to. I have told a few of my friends about it and thay to are going to get a dell also.",To be derived,To be derived,To be derived,To be derived,To be derived,,,
Inspiron 15,ecommerce Website,19/11/2013,5/5,"I am very pleased with this product, It works great with surfing the web, light gaming and watching videos. I am very pleased with my dell. I did however go for the upgraded ram to a 6GB and a non-touch, which may make a difference in performance. Stays cool after long usage, my only complain is that if you type with your wrist resting on the front edge of the laptop, it really digs into your skin.",To be derived,To be derived,To be derived,To be derived,To be derived,,,
Inspiron 15,ecommerce Website,19/11/2013,5/5,"IT IS VERY GOOD,I USE IT EVERY DAY AND IT IS VERY USEFULL TO ME.",To be derived,To be derived,To be derived,To be derived,To be derived,,,
Inspiron 15,ecommerce Website,19/11/2013,5/5,"I am a highschool student, and I was looking to purchase a laptop that was quicker to make school work easier. This laptop is great not only for school work, but every other type of daily use. It loads videos on Netflix in a matter of seconds. It is fast for web surfing (even with the Celeron core). One great feature is the start up time, which takes under a minute. The battery life is decent. I get over 4 hours on light usage. It is also very quiet (you cant hear the fan) and it doesn't get hot. Two complaints that I saw when researching were that the trackpad is unresponsive and the keyboard is hard to type on and not well built. I would disagree with both of those. The track pad on mine is very responsive, and the keyboard is well built and easy to type on. Another complaint was windows 8. personally, I think it is a huge improvement from windows 7. it is much easier to personalize and to use.
Overall this laptop is a great bargain. It is well built (the fact that it is plastic isn't an issue - it is very sturdy and the texture is nice for repelling fingerprints), and works perfectly. I have had no issues with it at all.",To be derived,To be derived,To be derived,To be derived,To be derived,,,
Inspiron 15,ecommerce Website,19/11/2013,5/5,"I love this laptop.This is my second laptop, and this is awesome the Intel Core i3 Processor provides very fast and powerful performance for my Inspiron 15.My laptop is ideal for students like me and i would recommend this laptop to anyone
And this laptop is selling out very fastly in my country,Sri Lanka.It is the most-selling laptop in my country.The Quality of the Display is very bright and vivid.The Touchpad is very responsive and the Sound Quality is Superb!Overall the best Value for the Money.You will never go wrong with this laptop.Inspiron 15 is a Spectacular Laptop.Thank you Dell For making a very good laptop like this,Thank You Dell.",To be derived,To be derived,To be derived,To be derived,To be derived,,,
Inspiron 15,ecommerce Website,19/11/2013,5/5,"I received my computer back in april and im really surprised by its performance. i have the i3 3rd gen. with 6gb of ram. its very responsive. i read other reviews, i have no clue what others are talking about, my computer boots up exceptionally quick. i do a lot of media editing, student work and i put the processor and graphics to the test. they are standing strong. im running programs very heavy on the processor such as ableton live and adobe photoshop and im not disappointed. if someone will tell you otherwise about this processor's abilities, theyre not the ""expert"" they're claiming to be.",To be derived,To be derived,To be derived,To be derived,To be derived,,,
Inspiron 15,ecommerce Website,19/11/2013,5/5,"I did a lot of research before buying the Inspiron 15 from Dell. In terms of features for $, I couldn't find a better deal than Dell. As well, buying from a reputable source sealed the deal.",To be derived,To be derived,To be derived,To be derived,To be derived,,,
Inspiron 15,ecommerce Website,19/11/2013,5/5,"It's a great machine. Work Well and give me 100% satisfaction.
Thanks Dell !",To be derived,To be derived,To be derived,To be derived,To be derived,,,
Inspiron 15,ecommerce Website,19/11/2013,5/5,This is a great item and has wonderful features. I would recommend this product to anyone,To be derived,To be derived,To be derived,To be derived,To be derived,,,
Inspiron 15,ecommerce Website,11/12/2013,4/5,"Affordable computer, excellent performance..great for college kids.",To be derived,To be derived,To be derived,To be derived,To be derived,,,
Inspiron 15,ecommerce Website,11/10/2013,5/5,"I bought this laptop as a gift for someone and they loved it, it works really good.",To be derived,To be derived,To be derived,To be derived,To be derived,,,
Inspiron 15,ecommerce Website,12/12/2013,4/5,"Hey it's not perfect, but you can't beat the overall performance for the price.",To be derived,To be derived,To be derived,To be derived,To be derived,,,
Inspiron 15,ecommerce Website,19/11/2013,4/5,"Great assets, lightweight, excellent battery time and screen resolution and brightness. Great laptop overall.",To be derived,To be derived,To be derived,To be derived,To be derived,,,
Inspiron 15,ecommerce Website,19/11/2013,4/5,"It has a clear, sharp wide screen and boots up quickly. I am quite happy with this machine.",To be derived,To be derived,To be derived,To be derived,To be derived,,,
Inspiron 15,ecommerce Website,19/11/2013,4/5,"This is one great laptop and a great deal. I see allot of reviews saying haw bad windows 8 but it just takes a little getting use to, once you know how to use the feature it has it works great. Though I did not get the touch screen and should have for windows 8.",To be derived,To be derived,To be derived,To be derived,To be derived,,,
Inspiron 15,ecommerce Website,11/12/2013,4/5,I recommend any dell product to anybody !!!!!!!! We own several dell laptops and never had any grief on buying any of them.,To be derived,To be derived,To be derived,To be derived,To be derived,,,
Inspiron 15,ecommerce Website,11/10/2013,4/5,Enjoying my new laptop. Surpassed my expectations. Highly recommend it!,To be derived,To be derived,To be derived,To be derived,To be derived,,,
Inspiron 15,ecommerce Website,12/12/2013,4/5,Have had no problems....love the machine! Enjoy the speed...the touch screen...and overall display.,To be derived,To be derived,To be derived,To be derived,To be derived,,,
Inspiron 15,ecommerce Website,19/11/2013,4/5,This pc has great features and i ues it for everything,To be derived,To be derived,To be derived,To be derived,To be derived,,,
Inspiron 15,ecommerce Website,19/11/2013,4/5,"First off, I want to say I have the ipad mini, iPad 2, the nook HD, and the kindle fire HD. All very impressive tablets. However, I've always wanted a tablet with enough power to run Windows 8. After weeks of research, I had my eye on the Sony Tap 11, Microsoft surface 2, Microsoft surface pro 2, Acer w4, and the Lenovo miix2. I've experimented with other tablets including the surfaces and found a strong interest in their performance but I couldn't agree with the prices and the strip down version of windows 8. Then I found this little gem. A tablet with powerful hardware, a full windows 8.1 os, and a price nearly impossible to beat. The reviews seemed to rate this tablet 4.5/5 I was convinced. After receiving the product, I fell in love with the performance as well as the speed, capabilities, and execution of the tablet. I stream all my files from my laptop which allows me to relax without carrying my laptop around. As for the Windows 8, in the beginning, I was never drawn to the OS because windows 7 was all I accepted. Yet, I truly feel that the windows 8 should remain existent to only touch base computers and tablets because the shortcuts you hate on windows 8 will be the things you appreciate using this tablet. I seriously recommend this tablet. Pros:full windows 8.1, full microsoft office 2013 student home, speed and touch sensitivity, great brightness at its resolution Cons:driver updates for cpu, sound is decent, may need stylus for desktop.",To be derived,To be derived,To be derived,To be derived,To be derived,,,
Inspiron 15,ecommerce Website,19/11/2013,4/5,"I am a technical professional 'veteran' (which just means old) of the semiconductor industry. I have long been searching for a single, very mobile device that allows to travel light, yet effectively be capable when needed. (my company is a MS based enterprise). I was pleasantly surprised with this device. I'll try and highlight my experience (I now have 2 :) one for the wife. Highlights- Screen - Excellent. Won't be redundant here with detail, Performance - Excellent, surprisingly so. I run full Office365, some SharePoint apps and an old version of Paperport. No lag at all. Extremely pleased.Connectivity - Excellent. The dual band WiFi has so far exceeded any other mobile device I've owned. One exception and this one of only 2 minor misses. Miracast for display is problematic(but works..with effort) Knew this going in, but a mini-HDMI would make this an amazing tool for a traveling professional. Input devices : This one disappointed me a bit. If you are looking for a similar stylus experience to the 'note' then this isn't for you if it's critical. Very 'marginal' for handwritten notes in 'OneNote'. Strokes are sensitive, but 'jittery'. I use it for the handwriting input panel in Win8.1 and works fine for this. No issues hooking up Bluetooth mouse and keyboard. Personal use : Excellent. NOTE: I would recommend only 64GB model! I made a mistake on my first one and ended up with 32GB (wife has this now) :) In my opinion, 32GB should not be sold. You max out the memory in a heart beat, especially if you're using business apps. Works excellent as media/reader/movies etc. 5GB 1080P MKV files with pass through DTS audio play flawless in VLC.I give value 5 for 5 despite the 2 minor misses as I consider those my 'quest for the ultimate portable' and it's hard to knock considering the price-point and value. If this device had a mini-HDMI so I could use to present PPT and a smoother stylus for hand-writing notes on par with wacomm...This would be the device I have always searched for. But hey, for the money amazing value/performance and quality. Nice Job Dell. Pros:screen, performance, mobility, battery, quality of build Cons:stylus - 'jittery' but sensitive, no mini-hdmi.",To be derived,To be derived,To be derived,To be derived,To be derived,,,
